[
 {
     "field_name": "2MW_test_1",
     "form_name": "2MW_test",
     "section_header": "2MW Test",
     "field_type": "info",
     "field_label": "",
     "select_choices_or_calculations": [ {
       "label" : "Trovi un percorso con una distanza di 10 metri dove può facilmente camminare avanti e indietro.",
       "code" : "Parte 1"
     }, {
       "label" : "Una volta indossata la cintura intorno al torace cammini avanti e indietro per 2 minuti fino a quando il cellulare indicherà di fermarsi.",
       "code" : "Parte 2"
     }, {
       "label" : "Si senta libero di interrompere il cammino nel caso avesse bisogno di riposarsi.",
       "code" : "Parte 3"
     }, {
       "label" : "Prema ‘Successivo’ per iniziare.",
       "code" : "Parte 4"
     } ],
     "field_note": "",
     "text_validation_type_or_show_slider_number": "",
     "text_validation_min": "",
     "text_validation_max": "",
     "identifier": "",
     "branching_logic": "",
     "required_field": "",
     "custom_alignment": "",
     "question_number": "",
     "matrix_group_name": "2MW",
     "matrix_ranking": "",
     "field_annotation": "",
     "evaluated_logic": ""
 },
 {
     "field_name": "2MW_test_2",
     "form_name": "2MW_test",
     "section_header": "2MW Test",
     "field_type": "timed",
     "field_label": "Inizi a camminare avanti e indietro.",
     "select_choices_or_calculations": [],
     "field_note": "",
     "text_validation_type_or_show_slider_number": "",
     "text_validation_min": "",
     "text_validation_max": "",
     "identifier": "",
     "branching_logic": "",
     "required_field": "",
     "custom_alignment": "",
     "question_number": "",
     "matrix_group_name": "2MW",
     "matrix_ranking": "",
     "field_annotation": {
       "image" : "assets/imgs/2MWT_walking.png",
       "timer" : {
         "start": 120,
         "end": 0
       },
       "unit" : "sec"
     },
     "evaluated_logic": ""
 }
]
