[
 {
     "field_name": "2MW_test_1",
     "form_name": "2MW_test",
     "section_header": "2MW Test",
     "field_type": "info",
     "field_label": "",
     "select_choices_or_calculations": [ {
       "label" : "Make yourself comfortable, and in standing position. Your feet should be together and your hands by your side.",
       "code" : "Part 1"
     }, {
       "label" : "Press the start button. A timer will count down the seconds.",
       "code" : "Part 2"
     }, {
       "label" : "After 10 seconds, a beep will alert you to continue the exercise with your eyes closed.",
       "code" : "Part 3"
     } ],
     "field_note": "",
     "text_validation_type_or_show_slider_number": "",
     "text_validation_min": "",
     "text_validation_max": "",
     "identifier": "",
     "branching_logic": "",
     "required_field": "",
     "custom_alignment": "",
     "question_number": "",
     "matrix_group_name": "romberg",
     "matrix_ranking": "",
     "field_annotation": "",
     "evaluated_logic": ""
 },
 {
     "field_name": "2MW_test_2",
     "form_name": "2MW_test",
     "section_header": "2MW Test",
     "field_type": "timed",
     "field_label": "Start walking back and forth.",
     "select_choices_or_calculations": [],
     "field_note": "",
     "text_validation_type_or_show_slider_number": "",
     "text_validation_min": "",
     "text_validation_max": "",
     "identifier": "",
     "branching_logic": "",
     "required_field": "",
     "custom_alignment": "",
     "question_number": "",
     "matrix_group_name": "romberg",
     "matrix_ranking": "",
     "field_annotation": {
       "image" : "assets/imgs/2MWT_walking.png",
       "timer" : {
         "start": 120,
         "end": 0
       },
       "unit" : "sec"
     },
     "evaluated_logic": ""
 }
]
