[
 {
     "field_name": "romberg_1",
     "form_name": "romberg_test",
     "section_header": "Romberg's Test",
     "field_type": "info",
     "field_label": "",
     "select_choices_or_calculations": [ {
       "label" : "Si metta comodo e si metta in piedi. Unisca i piedi e distenda le braccia lungo i fianchi.",
       "code" : "Parte 1"
     }, {
       "label" : "Schiacci il bottone ‘Successivo’. Un cronometro conterà i secondi.",
       "code" : "Parte 2"
     }, {
       "label" : "Dopo 10 secondi, un ‘beep’ la avviserà di continuare l’esercizio con gli occhi chiusi.",
       "code" : "Parte 3"
     } ],
     "field_note": "",
     "text_validation_type_or_show_slider_number": "",
     "text_validation_min": "",
     "text_validation_max": "",
     "identifier": "",
     "branching_logic": "",
     "required_field": "",
     "custom_alignment": "",
     "question_number": "",
     "matrix_group_name": "romberg",
     "matrix_ranking": "",
     "field_annotation": "",
     "evaluated_logic": ""
 },
 {
     "field_name": "romberg_2",
     "form_name": "romberg_test",
     "section_header": "Romberg's Test",
     "field_type": "timed",
     "field_label": "Tenga gli occhi aperti",
     "select_choices_or_calculations": [],
     "field_note": "",
     "text_validation_type_or_show_slider_number": "",
     "text_validation_min": "",
     "text_validation_max": "",
     "identifier": "",
     "branching_logic": "",
     "required_field": "",
     "custom_alignment": "",
     "question_number": "",
     "matrix_group_name": "romberg",
     "matrix_ranking": "",
     "field_annotation": {
       "image" : "assets/imgs/eyesopen.png",
       "timer" : {
         "start": 20,
         "end": 11
       },
       "unit" : "sec"
     },
     "evaluated_logic": ""
 },
 {
     "field_name": "romberg_3",
     "form_name": "romberg_test",
     "section_header": "Romberg's Test",
     "field_type": "timed",
     "field_label": "Chiuda gli occhi",
     "select_choices_or_calculations": [],
     "field_note": "",
     "text_validation_type_or_show_slider_number": "",
     "text_validation_min": "",
     "text_validation_max": "",
     "identifier": "",
     "branching_logic": "",
     "required_field": "",
     "custom_alignment": "",
     "question_number": "",
     "matrix_group_name": "romberg",
     "matrix_ranking": "",
     "field_annotation": {
       "image" : "assets/imgs/eyesclosed.png",
       "timer" : {
         "start": 10,
         "end": 0
       },
       "unit" : "sec"
     },
     "evaluated_logic": ""
 }
]
